{"apiVersion":"kernel-zero.dev/exceptions/v1","expiresAt":"2026-01-16T12:00:00.000Z","generatedAt":"2026-01-15T12:00:00.000Z","grants":[{"exceptionId":"0195f000-0000-7000-8000-000000000003","fingerprint":"sha256:3333333333333333333333333333333333333333333333333333333333333333","ruleId":"layers-no-ui-db","validUntil":"2026-02-01T00:00:00.000Z"}],"integrity":{"algorithm":"sha256","digest":"sha256:5555555555555555555555555555555555555555555555555555555555555555"},"kind":"ExceptionGrantSet","policyDigest":"sha256:1111111111111111111111111111111111111111111111111111111111111111","signature":{"algorithm":"ed25519","keyId":"workspace-key-id","value":"AAAAAAAAAAAAAAAAAAAAAAAAAAAAAAAAAAAAAAAAAAAAAAAAAAAAAAAAAAAAAAAAAAAAAAAAAAAAAAAAAAAAAA=="},"workspace":"0195f000-0000-7000-8000-000000000002"}
